	id	Judge	Education:	Began Service:	Appointed By:	Circuit Assignment:	Government:	Judicial:	Legal Practice:
277	0	 (recalled) Herbert A.	N / A	N / A	N / A	N / A	N / A	N / A	N / A
230	1	 A. Raymond Randolph	N / A	N / A	N / A	N / A	N / A	N / A	N / A
10	2	 Alan D. Lourie	 April 11, 1990	 President George H.W. Bush	N / A	N / A	N / A	N / A	 American Bar Association; American Intellectual — Property Law Association; Philadelphia Patent Law Association
116	3	 Alan E. Norris	 1986	 President Ronald Reagan	N / A	 City Prosecutor, City of Westerville (1962-1966); Member, Ohio House of Representatives (1967-1980}	 Judge, Ohio Court of Appeals (1981-1986)	 Vorys, Sater, Seymour & Pease (1961-1962); Partner, Metz, Bailey, Norris & Spicer (1962-1980)	 American Bar Association; American Judicature Society; Columbus Bar Association; Institute of Judicial Administration; Ohio State Bar Association
155	4	 Alex Kozinski	 November 7, 1985	 President Ronald Reagan	N / A	 Deputy Legal Counsei, Office of President-Elect Reagan (1980-1981); Assistant Counsel, Office of Counsel, Executive Office of the President (1981); Special Counsel, Merit Systems Protection Board (1981-1982)	 Chief Judge, United States Claims Court (1982-1985)	 Forry, Golbert, Singer & Gelles (1977-1979); Covington	N / A
170	5	 Alfred T. Goodwin	 1972	 President Richard M. Nizon	N / A	N / A	 Judge, Oregon Circuit Court, Second Judicial District (1955-1960), Associate Justice, Oregon Supreme Court (1960-1969); Fudge, United States District Court for the District of Oregon (1969-1971)	 Lawyer, Darling, Vonderheit & Goodwin (1951-1955) Military Service: United States Army (1942-1946); United States Army Reserve (1946-1969)	 American Bar Association; American Bar Foundation; American Judicature Society; American Law Institute; Oregon State Bar
102	6	 Alice M. Batchelder	 1992	 President George H.W. Bush	N / A	N / A	 Bankruptcy Judge, United States Bankruptcy Court for the Northern District of Ohio (1983-1985); District Fudge, United States District Court for the Northern District of Ohio (1985-1992)	 Partner, Williams & Batchelder (1971-1983)	 American Bar Association; Federal Bar Association; Federal Judges’ Association; Medina County Bar Association
87	7	 Allyson K. Duncan	N / A	N / A	N / A	N / A	N / A	N / A	N / A
57	8	 Amalya L. Kearse	 June 1979	 President Jimmy Carter	N / A	N / A	N / A	 Associate, Hughes, Hubbard & Reed (1962-1969); Partner, ; Hughes, Hubbard & Reed (1969-1979)	 American Bar Association; American Law Institute; American College of ‘Trial Lawyers; Association of the Bar of the City of New York
156	9	 Andrew J. Kleinfeld	 1991	 President George H.W. Bush	N / A	N / A	 Magistrate Judge (part-time), United States District Court for the	N / A	 Alaska Bar Association; Tanana Valley Bar Association
127	10	 Ann Claire Williams	N / A	 President William J. Clinton	N / A	 Assistant United States Attorney, Northern District of Milinois, Department of Justice (1976-1985)	 District Judge, United States District Court for the Northern	N / A	 Cook County Bar Association; Federal Bar Association; Federal Judges Association; Illinois Judicial Council; Just the Beginning Foundation, Chair; Women’s Bar Association of Hlinois
59	11	 Anthony J. Scirica	N / A	N / A	N / A	N / A	N / A	N / A	N / A
3	12	 Anthony M. Kennedy	 February 18, 1988 ‘	 President Ronald Reagan	 Eleventh Judicial Circuit Academic: Professor, McGeorge School of Law, University of the Pacific (7965-1988) Judicial: Circuit Judge, United States Court of Appeals for the Ninth Circuit (1975-1988) Spring 2005 © Leadership Directories, Inc. Judicial Yellow Book - » Judisial Yeliow Book Supreme Court of the United States 5 “of Associate Justice Anthony M. Kennedy continued S ctice: Associate, Thelen, Marrin, John & Bridges (1961-1963); Coen ay (1963-1967); Partner, Evans, Jackson & Kennedy “Service: California Army National Guard (1961) erships: American Bar Association; Sacramento County - State Bar of California cation: Chicago 2003 JD “ger! LAW Clerk, Judge Richard A. Posner, United ates Court of Appeals for the Seventh Circuit cation: Stanford JD oe ; aieer: Law Clerk, Judge Alex Kozinski, United ites Court of Appeals for the Ninth Circuit cation: Harvard JD geer. Law Clerk, Judge J. Michael Luttig, United ates Court of Appeals for the Fourth Circuit dication: Harvard JD gree: Law Clerk, Judge Stephen F. Williams, ited States Court of Appeals for the District of * umbia Circuit ambers of Associate Justice David H. Souter 1S; Supreme Court Building, One First Street, NE, fashington, DC 20543 el: (202) 479-3000 David H. Souter Associate Justice Date of Birth: 1939 Education: Harvard 1961 AB; Oxford (UK) 1963 AB; Harvard 1966 LLB; Oxford (UK) 1989 MA Began Service; October 9, 1990 Appointed By: President George H.W. Bush Cireuit Assignment: First Judicial Circuit; Third Judicial Circuit ;		 Circuit Judge, United States Court of Appeals for the Ninth Circuit	N / A	N / A
2	13	 Antonin Scalia	 September 26, 1986	 President Ronald Reagan	 Fifth Jadicial Circuit Academic: Professor, University of Virginia (1967-1971); Visiting Professor, Georgetown University (1977); Professor, University of Chicago (1977-1982); Visiting Professor, Stanford University (1980-1981) : Corporate: Editor, Regulation Magazine (1979-1982)	 General Counsel, Office of Telecommunications Policy, Executive Office of the President (1971-1972); Chairman, Administrative - Conference of the United States (1972-1974); Assistant Attorney General,: Office of Legal Counsel, Department of Justice (1974-1977)	 Circuit Judge, United States Court of Appeais for the District of’. Columbia Circuit (1982-1986)	 Jones, Day, Cockley & Reavis (1961-1967) Nonprofit: Resident Scholar, American Enterprise Institute (£977)	 Ohio Bar Association; Virginia Bar Association
150	14	 Arthur Federman	N / A	N / A	N / A	N / A	N / A	N / A	N / A
14	15	 Arthur J. Gajarsa	 September 12, 1997	 President William J. Clinton	N / A	 Special Counsel and Assistant to the Commissioner of Indian	N / A	 Associate, Duncan & Brown (1971-1972); Gajarsa, Liss &	N / A
175	16	 Arthur L. Alarcon	 November 20, 1979	 President Jimmy Carter	N / A	 Deputy District Attorney, Los Angeles County, State of California (1952-1961); Legal Advisor and Clemency and Extradition Secretary to Governor Edmund G. (Pat) Brown, State of California (1961-1962); Executive Assistant to Governor Edmund G. (Pat) Brown, State of California (1962-1964)	 Judge, California Superior Court, Los Angeles County	N / A	 American Bar Association; Los Angeles Bar Association
30	17	 Arthur N. Votolato	 June 25, 1968	N / A	N / A	 Chief Special Counsel, Department of Public Works, State af	N / A	 Partner, Votolato & Votolato (1956-1962) Military Service: United States Marine Corps Reserve (1949-1950); Unite States Air Force (1950-1951) :	 Federal Bar Association; Rhode Island Bar Association United States Bankruptcy Appellate Panel for the First Circuit 15 gankruptoy Judge Sara E. de Jesus continued dministrative Law Judge, Social Security Administration, Health and Human Services , cer Associate, Jimenez & Fuste; Partner, Brown, Newsom & ice: e herships: American Maritime Law Association; National mm Bankruptcy Judges; Puerto Rican Bankruptcy Bar dns: Puerto Rican Bar Association Emma Luiggi ...--- Lect eb eee tenes ee ae (787) 977-6023 5 eee Rico 1975 ID ic Rebeca Malaué .. «1.00... 6... eee eee (787) 977-6021 - Puerto Rico 2003 JD Lan mis aPntn vot T Veh eae oT aE ae (787) 977-6021 bers of Bankruptcy Judge James B. Haines, Jr. gress St., Portland, ME 04101 2).780-3653 Fax: (207) 780-3766 EB. Haines, Jr. “Expires: August 2018 ation: Bankruptcy Judge, United States Bankruptcy Court for the ict of Maine lemic: Associate Professor of Law, University of West Virginia 1983) Ships: Judicial Law Clerk The Honorable Eugene A. Wright, United Court of Appeals for the Ninth Circuit (1977-1978) ractice: Associate, Davis, Wright, Todd, Riese & Jones; Hewes, Jey & Beals (1983-1986); Partner, Black, Lambert, Coffin & Haines 86-1990) Military Service: United States Coast Guard (1970-1974) rent Memberships: American Bankruptcy Institute; Federal Judicial et, Bankruptcy Education Committee; National Conference of
22	18	 B,	 1974	 President Gerald Ford	N / A	N / A	 Judge, United States District Court for the District of Puerto Rico (1974-1982); Member, Judicial Conference of the United States (1994-2001) :	 Associate then Partner, Fiddter, Gonzalez & Rodriguez (1960-1967); Private Practice (1967-1974)	 Academia Puertorriquena de Jurisprudencia y Legislacion; American Bar Association; Colegio de Abogados de Puerto Rico; District of Columbia Bar; Federal Bar Association
46	19	 Barrington D. Parker, Jr.	 October 2001	 President George W. Bush	N / A	N / A	 District Judge, United States District Court for the Southern District of New York (1994-2001)	 Associate, Sullivan & Cromwell (1970-1977); Partner,	N / A
148	20	 Barry 5S. Schermer	 1997	N / A	N / A	N / A	N / A	N / A	N / A
159	21	 Barry G. Silverman	N / A	 President William J. Clinton	N / A	 Court Commissioner, Arizona Superior Court, Maricopa County (1979-1984)	 Judge, Arizona Superior Court, Maricopa County (1984-1995);	N / A	 American Bar Association; Federal Bar Association; Maricopa County Bar Association; State Bar of Arizona
256	22	 Benjamin	N / A	N / A	N / A	N / A	N / A	N / A	N / A
265	23	 Bert W. Milling, Jr.	 1986	N / A	N / A	 Special Assistant, Office of the Attorney General, State of Alabama (1974-1975); Assistant District Attorney, State of Alabama (1977-1978); Counsel, Subcommittee on Security and Terrorism, Committee on the Judiciary, United States Senate (1981-1983); Assistant United States Attorney, Southern District of Alabama, Department of Justice (1983-1986)	 Court Referee, Alabama Circuit Court, 13th Judicial Circuit (1978-1981)	 Private Practice (1975-1977) Military Service: United States Army (1971-1974); Alabama National Guard, United States Army Reserve (1975-1987)	 Alabama Bar Association; Christian Legal Society; Federal Magistrate Judges Association; Mobile Bar Association
101	24	 Boyce F. Martin, Jr.	 October 5, 1979	 President Jimmy Carter	N / A	 First Assistant, Office of the County Attorney, Jefferson County (1970-1974); United States Attorney, Wester: District of Kentucky, Department of Justice (1965); Assistant United States Attorney, Western District of Kentucky, Department of Justice (1964-1965)	 Judge, Kentucky Cireuit Court, Jefferson County (1974-1976), Chief Judge, Kentucky Court of Appeals (1976-1979); Chief Judge, United States Court of Appeals for the Sixth Circuit (2003); Member, Judicial. Conference of the United States (1996-2003)	 Brown & Eldred (1966-1969); Stites & McElwain (1970-1972); Greenebaum, Martin, Barnett & McConnell (1972-1974) Military Service: United States Army (1958-1966)	 American Bar Association; American Bar Foundation; American Judicature Society; Federal Bar Association; Kentucky Bar Association; Louisville Bar Association
21	25	 Bruce M. Selya	N / A	N / A	N / A	N / A	N / A	N / A	N / A
246	26	 C. Lynwood Smith, Jr.	 January 4, 1996	 President William J. Clinton	N / A	N / A	 Judge, Alabama Circuit Court, 23rd Judicial Cirenit (1981-1995) Presiding Judge, Alabama Circuit Court, 23rd Judicial Circuit (1995-199	 Beli, Richardson, Cleary, McLain & Tucker (1972-1975);	N / A
261	27	 C. Michael Stilson	 June 16, 1995	N / A	N / A	 Chapter 13 Standing Trustee (1990-1995)	N / A	N / A	 Alabama Bar Association; National Conference Bankruptcy Judges; Tuscaloosa County Bar Association 
197	28	 Carlos F Lucero	 July 22, 1995	 President William J. Clinton	N / A	N / A	N / A	 Researcher, Harold L. Haun, Attorney (1973)	N / A
168	29	 Carlos T. Bea	N / A	N / A	N / A	N / A	N / A	N / A	N / A
263	30	 Charles &. Butler, Jr.	N / A	N / A	N / A	N / A	N / A	N / A	N / A
296	31	 Charles R. Pyle	 June 28, 2002	N / A	N / A	 Pima County Attorney’s Office (1987-1989); State Attorney	N / A	 Southern Arizona Legal Aid (1977-1987)	 Federal Bar Association; Pima County Bar Association
219	32	 Charles Reginald Wilson	 September 30, 1999	 President William J. Clinton	N / A	N / A	 County Judge, Thirteenth Judicial Circuit of Florida (1986-1990); Magistrate Judge, United States District Court for the Middle of the District of Florida (1990-1994)	 Private Practice (1981-1986)	 American Law Institute; Federal Bar Association; Ferguson-White Inn of American Inns of Court; Florida Bar Association
240	33	 Charles S.	N / A	N / A	N / A	N / A	N / A	N / A	N / A
43	34	 Chester J. Straub	 July 15, 1998	 President William J. Clinton	N / A	N / A	 Special Master, New York State Supreme Court, County of New York (1977-[984)}; Mediator, United States District Court for the Southern ; District of New York (1993-1998); Neutral Evaluator/Mediator, United States District Court for the Eastern District of New York (1994-1998)	 Associate, Willkie Farr & Gallagher (1963-1970); Partner, — Willkie Farr & Gallagher (1971-1998) Military Service: United States Army (1961-1963)	 American Bar Association; Association of the Bar :' of the City of New York; New York State Bar Association
188	35	 Christopher M. Klein	 May 1, 2060	N / A	N / A	 Trial Attorney, Department of Fustice (1978-1980)	N / A	 Cleary, Gottlieb, Steen & Hamilton (1980-1983); Deputy	N / A
285	36	 Cindy K. Jorgenson	 March 15, 2002	 President George W. Bush	N / A	 Deputy County Attorney, Pima County Attorney’s Office (1977-1986); Assistant United States Attorney, United States Attorney's Office, District of Arizona (1986-1996)	 Judge, Arizona Superior Court, Pima County (1996-2002)	N / A	N / A
4	37	 Clarence Thomas	 October 23, 1991	 President George H.W. Bush	 Eighth Fudicial Circuit Corporate: Attorney, Monsanto Company (1977-1979)	 Assistant Attorney General, State of Missouri (1974-1977); Legislative Assistant, United States Senator John C. Danforth (1979-1981); Assistant Secretary for Civil Rights, Department of Education (1981-1982); Chairman, Equal Employment Opportunity Commission (1982-1990)	 Circuit Judge, United States Court of Appeals for the District of	N / A	 Missouri Bar Association
88	38	 Clyde H. Hamilton	 July 22, 1991	 President George H.W. Bush	N / A	N / A	N / A	N / A	N / A
27	39	 Conrad K. Cyr	 November 20, 1989	 President George H.W. Bush	N / A	 Assistant United States Attorney, District of Maine, Department of Justice (1959-1961)	 Bankruptey Judge, United States Bankruptcy Court for the District of Maine (1961-1983), Standing Special Master, United States District Court for the District of Maine (1974-1976); Chief Judge, Bankruptcy Appellate Panel for the District of Massachusetts (1980-1981); District Judge, United States District Court for the District of Maine (1981-1989); Judge, United States Foreign Intelligence Surveillance Court (1987-1989)	 Private Practice (1956-1959); Partner, Winchell & Cyr (1960-1962)	 American Bar Association; American College of Bankruptcy, American Judicature Society; Aroostook County Bar Association; John Baliou American Inn of Court; Maine Bar Association: Maine Bar Foundation; Penobscot Bar Association; United States Agency for International Development Project for Assisting Bankruptcy and Reorganization Procedures in Central and Eastern Europe
167	40	 Consuelo Maria Callahan	N / A	N / A	N / A	N / A	N / A	N / A	N / A
113	41	 Cornelia G. Kennedy	N / A	N / A	N / A	N / A	N / A	N / A	N / A
67	42	 D. Brooks Smith	 September 23, 2002	 President George W. Bush	N / A	 Assistant District Attorney (part-time), Blair County, Commonwealth of Pennsylvania (1984-1984); District Attorney (part-time), Commonwealth of Pennsylvania (1983-1984)	 Judge, Pennsylyania Court of Common Pleas, Blair County (1984-1988); Judge, United States District Court for the Western District of Pennsylvania (1988-2002); Chief Judge, United States District Court for the Western District of Pennsylvania (2001-2002)	 Associate, Jubelirer, Carothers, Krier, Halpern & Smith (1976-1979); Partner, Jubelirer, Carothers, Krier, Halpern & Smith (1980-1984)	 Allegheny County Bar Association; American Judicature Society; American Law Institute; Federal Bar Association; Federal Judges Association; Pennsylvania Bar Association
68	43	 D. Michael Fisher	N / A	N / A	N / A	N / A	N / A	N / A	N / A
112	44	 Damon J. Keith	 October 1977	 President Jimmy Carter	N / A	N / A	 District Judge, United States District Court for the Eastern Distrigf of Michigan (1967-1977) ,	 Private Practice (1950-1964); Attorney, Office of the	N / A
124	45	 Daniel A. Manion	 1986	 President Ronald Reagan	N / A	 Director of Industrial Development, Department of	N / A	 Associate then Partner, Doran, Manion, Boynton, Kamm &	N / A
18	46	 Daniel M. Friedman	 May 19, 1978	 President Jimmy Carter	N / A	 Legal Staff, Securities and Exchange Commission	N / A	 Newman & Bisco {1940-1941}; L.N. Thurman (1941-1943) Military Service: United States Army (1942-1946)	 American Bar Association; American Law Institute; Federal Bar Association
228	47	 David B. Sentelle	N / A	N / A	N / A	N / A	N / A	N / A	N / A
286	48	 David C. Bury ‘ial Assistant Lissette Calderon.................. (520) 205-4500	 March 29, 2002	 President George W. Bush	N / A	N / A	N / A	 Associate, Robertson & Fickett (1967-1971); Partner,	N / A
287	49	 David G. Campbell	N / A	N / A	N / A	N / A	N / A	N / A	N / A
193	50	 David M. Ebel	 July 1988	 President Ronald Reagan	N / A	N / A	N / A	 Associate then Partner, Davis, Graham & Stubbs (1966-1988)	 American College of Trial Lawyers; Law Club; Tenth Circuit Discrimination Task Force
182	51	 David R. Thompson	 1985	 President Ronald Reagan	N / A	N / A	N / A	 Partner, Colton, Thompson & Thompson (1957-1965); Partner, Thompson &- Thompson (1965-1985) Military Service: United States Navy (1955-1957)	 American Bar Association; American Board of Trial Advocates; San Diego County Bar Association; State Bar of California
232	52	 David S. Tatel	N / A	N / A	N / A	N / A	N / A	N / A	N / A
109	53	 Deborah L. Cook	N / A	N / A	N / A	N / A	N / A	N / A	N / A
39	54	 Dennis Jacobs	 December 8 1992	 President George H.W. Bush	N / A	N / A	N / A	 Associate, Simpson, Thacher & Bartlett (1973-1980); Partner, Simpson, Thacher & Bartlett (1980-1992)	 Association of the Bar of the City of New York: Federalist Society
190	55	 Dennis Montali	N / A	N / A	N / A	N / A	N / A	 Partner, Dinkelspiel, Pelavin, Steefel, and Levitt (1980) Associate then Partner, Rothschild, Phetan, & Montali (1968-1980); Partner, Pillsbury, Madison, & Sutro (1981-1993) Military Service: United States Naval Reserve	 American Bar Association; American College Bankruptcy, Fellow; San Francisco Bar Association, Chair : Law Clerk Neil Bason ..................
86	56	 Dennis W. Shedd	 December 10, 2002	 President George W. Bush	N / A	 Administrative Assistant to Senator Strom Thurmond, United	N / A	N / A	N / A
83	57	 Diana Gribbon Motz	 June 1994	 President William J. Clinton	N / A	 Assistant Attorney General, Chief of Litigation, Attorney General’s Office, State of Maryland (1972-1986)	 Associate Judge, Maryland Court of Special Appeais (1 991-1994): -	 Associate, Piper & Marbury (1968-1971); Partner, Frank, Bernstein, Conaway & Goldman (1986-1991)	 American Bar Association; American Bar Foundation; Bar Association of Baltimore City; Maryland Bar Association; Maryland Bar Foundation; Women’s Bar Association of Maryland
125	58	 Diane PR. Wood	 July 24, 1995	 President William J. Clinton	N / A	 Aftorney-Advisor, Office of the Legal Advisor, United States	N / A	 Associate, Covington & Burlington (1978-1980)	 Académie Internationale de Droit Comparé; American Law Institute; American Society of International Law; Association of the Bar of the District of Columbia; [lincis Bar Association; International Academy of Comparative Law
128	59	 Diane S. Sykes	N / A	N / A	N / A	N / A	N / A	N / A	N / A
60	60	 Dolores K. Sloviter	 1979	 President Jimmy Carter	N / A	N / A	N / A	 Associate then Parmer, Dilworth, Paxson, Kalish, Kohn & Levy (1956-1969); Member, Harold E. Kohn, PA (1969-1972)	 American Bar Association; American Judicature Society; American Law Institute; Federal Bar Association; Federal Judges Association; National Association of Women Judges; National Constitution Center, Board of Directors; Pennsylvania Women’s Forum; Philadelphia Bar Association FEDERAL COURTS—UNITED STATES COURTS OF APPEALS
276	61	 Donald	 July 1990	N / A	N / A	N / A	N / A	N / A	N / A
177	62	 Dorothy Wright Nelson	N / A	N / A	N / A	N / A	N / A	N / A	N / A
140	63	 Duane Benton	 July 8, 2004	 President George W. Bush	N / A	N / A	N / A	N / A	N / A
243	64	 Dwight H. Williams,	 October 1999	N / A	N / A	 Case Administrator, United States Bankruptcy Court for the	N / A	N / A	 Alabama State Bar Association; Montgomery County Bar Association 
96	65	 Edith Brown Clement	N / A	N / A	N / A	N / A	N / A	N / A	N / A
97	66	 Edward C. Prado	N / A	N / A	N / A	N / A	N / A	N / A	N / A
98	67	 Edward C. Prado,	N / A	N / A	N / A	N / A	N / A	N / A	N / A
217	68	 Edward Carnes	 October 2, 1992	 President George H.W. Bush	N / A	N / A	N / A	N / A	N / A
183	69	 Edward Leavy	 March 23, 1987	 President Ronald Reagan	N / A	N / A	 Judge, Lane County District Court (1957-1961); Circuit	N / A	N / A
73	70	 Edward R. Becker	N / A	N / A	N / A	N / A	N / A	N / A	N / A
211	71	 Elizabeth E. Brown:	N / A	N / A	N / A	N / A	N / A	N / A	 American Bankruptcy Institute; Colorado Bat . Association; Colorado Bar Foundation; Denver Bar Association; Nation United States Court of Appeals for the Eleventh Circuit 75 rs if Wyoming i) 524-6572 7. Thurman cy Judge irth: 1947 ‘Utah 1971 BA, 1974 JD Fof Utah ence of Bankruptcy Judges Eleventh Circuit ‘Forsyth Street, Atlanta, GA 30303 04) 335-6100 www.ca] L-uscourts.gov www. law.emory.edn/] lcireuit of Judgeships: 12 ‘overed: Alabama, Florida and Georgia t 
186	72	 Elizabeth L.	 April 1984	N / A	N / A	 Bankruptcy Trustee, United States Bankruptcy Court	N / A	 Partner, McMenamin, Joseph, Babener, Greene and Perris (1977-1982); Partner, Greene and Perris (1983-1984)	 California State Bar; Oregon State Bar
93	73	 Emilio M. Garza	 Jume 7, 1991	 President George H.W. Bush	N / A	N / A	 Judge, Texas District Court, 225th Judicial District (1987-19g9\.: Judge, United States District Court for the Western District of Texas (1988-1991)	 Associate then Partner, Clemens, Spencer, Welmaker & .	N / A
226	74	 Emmett Ripley Cox	 1988	 President Ronald Reagan	N / A	N / A	 Judge, United States District Court for the Southern District of Alabama (1981-1988)	 Associate, Mead & Norman (1959-1964); Associate thet Partner, Gaillard, Wilkins, Smith & Cox (1964-1970); Partner, Nettles, Cox & Barker (1970-1981) Military Service: Air National Guard (1958-1964)	 Alabama Bar Association; Maritime Law Association of the United States; Mobile Bar Association Spring 2005 © Leadership Directories, Inc. Judicial Yellow Be United States Court of Appeals for the District of Columbia Cireuit 79 snior Judge Emmett Ripley Cox continued ron Rhonda Case................ (251) 690-2055 d States Court of Appeals for trict of Columbia Circuit an U.S. Courthouse, 333 Constitution Avenue, NW, Pes 20001-2866 5, 216-7000 973-0926 (Appellate Case Voice Information) 19-9589 (Electronic Opinions Data) 16-7296 (Electronic Opinions Voice} Fax: (202) 273-0988 -cadc.uscourts.gov
29	75	 Enrique S.	N / A	N / A	N / A	N / A	N / A	N / A	N / A
191	76	 Erithe A. Smith	N / A	N / A	N / A	N / A	N / A	 McKittrick, Jackson, DeMarco & Peckenpaugh (1985-1987); Lobel, Winthrop & Broker (1987-1994)	 American Bankruptcy Institute; American Bart’ Association; National Conference of Bankruptcy Judges; Orange County. Court Deputy Cynthia Turnbull...................--. (520) 202-7500 Byron White U.S. Courthouse, 1823 Stout Street, Denver, CO 80257 Court Reporter Beverly Granillo..00 0.0.00. 00.2.2 (520) 202-7500 ‘Tel: (303) 844-3157 oo Judicial Assistant Maureen Thompson ............... (520} 202-7984 Tel: (303) 844-5682 (Electronic Opinions and Dockets Data) Circuit Executive David Tighe ............ Education: Penn State 1974 BS; Colorade 1989 JD United States Court of Appeals for Supreme Court Justice: Associate Justice Stephen G. Breyer Areas Covered: Colorado, Kansas, New Mexico, Oklahoma, Utah and ~ Spring 2005 © Leadership Directories, Inc. United States Court of Appeals for the Tenth Circuit 69 St : Court of Appeals for the Tenth Circuit continued tate: : éuit Executive Victoria M. Parks. ........... (303) 335-2630 oky parks@ca | 0.uscourts. gov Fax: (303) 335-2828 one Loretto Heights 1976 BA; jon: Lore : Pe nistion Services Mike Kopatich ........ (303) 335-3046 oe kopatich@ca! 0-uscourts.gov Fax: (303) 335-3022 Colorado State 1987 BA cenit Executive for Human Resources and iqtration Linda Rivas............ 2.00... ..00 (303) 335-2830 ada rivas@)cal Q.uscourts.gov Fax: (303) 335-2828 -Cijeuit Executive for Space and Facilities WOId os cs cece eee e cece en ee ences (303) 335-2903 at naromervold@calO.usvourts,gov Fax: (303) 335-2828 the Court Patrick J. Fisher, Jr ............... (303) 844-3157 atrick_fisher@ca0.uscourts.gov Fax: (303) 844-2540 ‘on: Notre Dame 1967 BA; en Gate 1981 JD Siaff Counsel Niki Heller’ «sci co gies wire ves (303) 844-5306 *s. piic_heller@cal 0.uscourts. gov Fax: (303) 844-3733 ‘on: Wyoming 1984 BS, 1988 ID
117	77	 Eugene E. Siler, Jr.	 September 17, 1991	 President George H.W. Bush	N / A	 Attorney, Whitley County {1965-1970}; United States Attomey, Eastern District of Kentucky, Department of Justice (1970-1975)	 United States District Judge, United States District Courts for the Eastern and Western Districts of Kentucky {1975-1991}	 Private Practice (1964-1970) Military Service: United States Navy (1958-1960); United States Naval. Reserve (1961-1983)	 District of Columbia Bar Association; Federal Bar Association; Federal Judges Association; Kentucky Bar Association; Virginia State Bar 
