	id	Judge	Education:	Began Service:	Appointed By:	Circuit Assignment:	Government:	Judicial:	Legal Practice:
231	147	 Judith W. Rogers	 March 21, 1994	 President William J. Clinton	N / A	 Assistant United States Attorney, District of Columbia, Department of Justice (1965-1968); Trial Attorney, Criminal Division, Department of Justice (1969-1971); General Counsel, Congressional Commission on the Organization of the District Government (1971-1972 Legislative Program Coordinator, Office of the Assistant to the Mayor-Commissioner, and later, Office of the Mayor, District of Colum’ (1972-1974); Special Assistant for Legislation to the Mayor, District of Cotumbia (1974-1979); Assistant City Administrator for Intergovernment Relations, District of Columbia; Corporation Counsel, District of Columbia (1979-1983) :	 Tudge, District of Columbia Court of Appeals (1983-1990), Chie	N / A	 American Bar Association; American Law Institute; District of Columbia Bar; National Association of Women Judges; National Bar Association
107	148	 Julia Smith Gibbons	N / A	N / A	N / A	N / A	N / A	N / A	N / A
66	149	 Julio M. Fuentes	 May 15, 2000	 President Willian J. Clinton	N / A	N / A	 Municipal Judge (part time), Newark Municipal Court (1978-1981); Judge, Newark Municipal Court (1981-1987); Judge, New Jersey Superior Court (1987-2000)	 Associate, Miller, Hochman, Meyerson & Schaeffer (1975-1977): Partner, Fuentes, Plant & Velazquez (1977-1981) Military Service: First Lieutenant, United States Army (1966-1969); United States Army Reserve (1969-1972)	 American Bar Association; Essex County Bar Association, National Hispanic Bar Association; New Jersey Bar Association; New Jersey Hispanic Bar Association
247	150	 KR. David Proctor	 September 24, 2003	 President George W. Bush	N / A	N / A	N / A	N / A	 Alabama State Bar Association; Birmingham Bar Association
81	151	 Karen Johnson Williams	N / A	N / A	N / A	N / A	N / A	N / A	N / A
229	152	 Karen LeCraft Henderson	N / A	N / A	N / A	N / A	N / A	N / A	N / A
104	153	 Karen Nelson Moore	 March 29, 1995	 President William J. Clinton	N / A	N / A	N / A	 Associate, Jones, Day, Reavis & Pogue (1975-1977)	 American Law Institute
123	154	 Kenneth F Ripple	 June 10, 1985	 President Ronald Reagan	N / A	 Legal Officer, Supreme Court of the United States	N / A	N / A	 American Bar Association; American Law Institute; Federal Bar Association; New York State Bar Association; Supreme Court Historical Society
134	155	 Kermit Edward Bye	 April 22, 2000	 President William J. Clinton	N / A	 North Dakota Deputy Securities Commissioner and Special	N / A	 Partner, Member and Stockholder, Vogel, Weir, Bye, Hunke & MeCormick (1968-2000)	 American Bar Association; American Bar Foundation; American Judicature Society; Federal Fudges Association; State Bar Association of North Dakota ,
24	156	 Kermit V. Lipez	 July 1, 1998	 President William J. Clinton	N / A	N / A	N / A	N / A	N / A
266	157	 Kristi D. Lee	 January 5, 2000	N / A	N / A	N / A	N / A	N / A	N / A
248	158	 L. Scott Coogler	N / A	N / A	N / A	N / A	N / A	N / A	N / A
234	159	 Laurence Hirsch Silberman	N / A	N / A	N / A	N / A	N / A	N / A	N / A
137	160	 Lavenski R. Smith	 July 19, 2002	N / A	N / A	 Regulatory Liaison, Arkansas Governor's Office (1996-1997); Chairman, Arkansas Public Service Commission (1997-1999)	 Associate Justice, Arkansas Supreme Court (1999-2000}	 Law Clerk, Hall, Wright & Morris (1985-1987); Staff	N / A
294	161	 Lawrence O. Andersoi	 September 23, 1998	N / A	N / A	N / A	 Judge, Arizona Superior Court, Maricopa County (1990-1998)	 Private Practice (1975-1990)	N / A
25	162	 Levin H. Campbell	N / A	N / A	N / A	N / A	N / A	N / A	N / A
31	163	 Louis H. Kornreich	 April 3, 2001	N / A	N / A	N / A	 Appellate Judge, Penobscot Indian Nation (1981-2001)	N / A	N / A
82	164	 M. Blane Michael	 October 12, 1993	 President William J. Clinton	N / A	 Assistant Linited States Attorney, Criminal Division,	N / A	 Sullivan & Cromwell (1968-1971); Sole Practitioner (1973-1975); Jackson & Kelly (1981-1993)	 American Bar Association; Judicial Conference Committee on the Budget; West Virginia Bar Association
161	165	 M. Margaret McKeown ted By: President William J. Clinton	 May 28, 1998	 President William J. Clinton	N / A	 White House Fellow, Special Assistant to the Secretary of the	N / A	 Associate then Partner, Perkins Coie, Washington, DC (1975-1998)	 American Bar Association; American Bar Foundation, Fellow; American Intellectual Property Law Association, American Law Institute; King County Bar Association; Washington State Bar Association; Washington Women Lawyers; White House Fellows Foundation, Board of Directors member dicial Secretary Uyen Koh .... 22.222. eee (415) 556-9800 hambers of Circuit Judge Raymond C. Fisher chard H. Chambers U.S. Court of Appeals Bldg., 125 S. Grand Ave., 3400, Pasadena, CA 91105 (626) 229-7110 Fax: (626) 229-7452 mail: rayrnond_fisher@ca9-uscourts.gov iymond C. Fisher uit Judge
65	166	 Marjorie O. Rendell	 Novernber 21, 1997 Appomted By: President William J. Clinton Judicial: Judge, United States District Court for the Eastern District of Pennsylvania (1994-1997) Legal Practice: Associate then Parmer, Duane, Morris & Heckscher (1973-1994) Current Memberships: American Bankruptcy Institute, American College of Bankruptcy, American Judicature Society; American Law Institute; Federal Judges Association; J. Willard O’Brien Inn of Court Staff Law Clerk Natalie Bucciarelli....................... (215) 597-3015 Law Cierk Sandra L. Moser ...................--... (215) 597-3015 Education; North Carolina 1998 AB, 1998 BA; Northwestern 2002 JD Law Clerk Matthew Mousley..............02..0.005 (215) 597-3015 Judicial Secretary Helen Burkholder.................. (215) 597-3015 Judicial Secretary Beth Cummings................... (215) 597-3015 Spring 2605 © Leadership Directories, Inc. Judicial Yellow Book = of Circuit Judge Maryanne Trump Barry Courthouse, P.O. Box 999, Newark, NJ 07101-0999 3 Fax: (973) 645-6628 : ber Office & ra 73} 045-212 ane Trump Barry Birth: 1937 . <a: Mount Halyoke 7958 BA; Columbia 1961 MA; Hofstra 1974 JD = Service! September 13, 1999 inted By: President William J, Clinton Affiliation: Republican nment: United States Attorney, District of New Jersey, Department of @ (1974-1983) iat: District Judge, United States District Court for the District of New araey (1983-1999) arent Memberships: American Bar Foundation; American Judicature ciety; Association of the Federal Bar of New Jersey; New Jersey Bar ~ spcjation; New York Bar Association Cherk Jonathan Katchen...... Eee ueuevosseese (973) 645-2133 ducation: Hastings 2004 JD Clerk Abigail Marshak............. eee (973) 648-2133 “Rducation: Comell 2004 JD aw Clerk Danie! Spector... .. 2.0.0... eee (973) 645-2133 ducation: Virginia 1997 BA; Chicago 2001 JD aw Clerk Bradley Wilson. ..............-........-- (973) 645-2133 ‘ducation: Cornell 2004 JD dicial Secretary Trinidad Heim..................... (973) 648-2133 ducation: U Guam 1976 BA fel: (302) 573-6500 Fax: (302) 573-6512 E-mail: judge_thomas_ambro@ca3-uscourts.gov Date of Birth: 1949 Education: Georgetown 1971 BA, 1975 JD Began Seryice: June 19, 2000	 President William J. Clinton	N / A	N / A	 Judge, United States District Court for the Eastern District of Pennsylvania (1994-1997)	 Associate then Parmer, Duane, Morris & Heckscher (1973-1994)	 American Bankruptcy Institute, American College of Bankruptcy, American Judicature Society; American Law Institute; Federal Judges Association; J. Willard O’Brien Inn of Court 
205	167	 Mark B.	 September 28, 1981	N / A	N / A	N / A	N / A	N / A	 Albuquerque Bar Association; National Conference of Bankruptcy Judges; New Mexico Bar Association
34	168	 Mark W. Vaughn	 November 12, 1993	N / A	N / A	N / A	N / A	 Officer and Shareholder, Devine, Millimet & Branch, PA. (1976-1993) Military Service: United States Navy (1963-1967)	 American Bankruptcy Institute, American Bar Association; American College of Bankruptcy; Manchester Bar Association; National Conference of Bankruptcy Judges; New Hampshire Bar Association; New Hampshire Bar Foundation
164	169	 Marsha S. Berzon	 March 21, 2000	 President William J. Clinton	N / A	N / A	N / A	 Associate, Woll & Mayer (1975-1977); Of Counsel, Altshuler & Berzon (1978-1990); Partner, Altshuler, Berzon, Nussbaum, Berzon & Rubin (1990-2000)	 American Bar Foundation, Fellow; American Judicature Society; American Law Institute; D.C. Bar Association; Federal Bar Association; National Association of Women Judges; State Bar of California
103	170	 Martha Craig Daughtrey	N / A	N / A	N / A	N / A	N / A	N / A	N / A
196	171	 Mary Beck Briscoe	 May 31, 1995	 President William J. Clinton	N / A	N / A	 Judge, Kansas Court of Appeals (1984-1996); Chu	N / A	N / A
283	172	 Mary H. Murguia	 December 2000	 President William J. Clinton	N / A	 Assistant District Attorney, Wyandotte County District	N / A	N / A	N / A
152	173	 Mary M. Schroeder	N / A	N / A	N / A	N / A	N / A	N / A	N / A
71	174	 Max Rosenn	 November 2, 1970	 President Richard M, Nixon	N / A	 Special Counsel, Department of Justice, Commonwealth of	N / A	 General Practice (1932-1941); Rosenn & Rosenn (1947-1954); Rosenn, Jenkins & Greenwald (1954-1970) Military Service: United States Army (1944-1946)	 American Bar Association; American College of Trial Lawyers; American Judicature Society; American Law Institute; Federal Bar Association; International Academy of Trial Lawyers; Luzerne County Bar Association; Pennsylvania Bar Association
180	175	 Melvin T. Brunetti	 1985	 President Ronald Reagan	N / A	 Member, Council of Legal Advisors, Republican National	N / A	 Associate, Vargas, Bartlett & Dixon (1964-1969); Associate then Partner, Laxalt, Bell, Berry, Alison & Lebaron (1970-1978); Member, Ailison, Brunetti, MacKenzie, Hartman, Soumbeniotis & Russell (1978-1985) Military Service: United States Army National Guard (1954-1956)	 American Bar Association; State Bar of Nevada; Washoe County Bar Association
199	176	 Michae! W. McConnell	N / A	N / A	N / A	N / A	N / A	N / A	N / A
20	177	 Michael Boudin	N / A	N / A	N / A	N / A	N / A	N / A	N / A
157	178	 Michael Daly Hawkins	 1994	 President William 7. Clinton	N / A	 United States Attorney, District of Arizona, Department of	N / A	 Daughton Feinstein & Wilson (1973-1976); Hofman Salcito & Stevens (1976-1977); Dushoff & Sacks (1980-1986), Partner, Daughton Hawkins & Bacon (1986-1988); Bryan Cave (1988-1992); Partner, Daughton Hawkins Brokelman Guinan & Patterson (1992-1994) Military Service: Captain, Special Court Military Judge, United States Marine Corps (1970-1973)	 Federal Bar Association; Horace Rumpole Inn of Court; Maricopa County Bar Association; National Association of Former United States Attorneys; State Bar of Arizona
136	179	 Michael J. Melloy	 February 26, 2002	 President George W. Bush	N / A	N / A	 Bankruptcy Judge, United States Bankruptcy Court for the Northern District of Iowa (1986-1992); District Judge, United States District Court for the Norther District of lowa (1992-2002)	 Partner, O’Connor, Thomas, Wright, Hammer, Bertsch & Norby (and predecessor firms) (1974-1986) Military Service: United States Army (1970-1972); United States Army Reserve (1972-1976)	 Dean Mason L. Ladd Inn of Court; Dubuque County Bar Association; lowa State Bar Association; Linn County Bar Association
203	180	 Monroe G. McKay	 December 1, 1977	 President Jimmy Carter	N / A	 Country Director, Malawi, Africa, Peace Corps (1966-196	N / A	N / A	 Arizona Bar Association
133	181	 Morris S. Arnold	N / A	N / A	N / A	N / A	N / A	N / A	N / A
75	182	 Morton I. Greenberg	 June 18, 1987	 President Ronald Reagan	N / A	 Law Clerk, Office of the Attorney General, State of New Jersey (1957-1958); Deputy Attorney General, State of New Jersey (1958-1960); Assistant Attorney General, State of New Jersey (1971-1973)	 Judge, New Jersey Superior Court, Law Division (1973-1976);	N / A	N / A
141	183	 Myron H. Bright	 1968	 President Lyndon B. Johnson	N / A	N / A	N / A	 Partner, Wattam, Vogel, Vogel, Bright and Peterson (1947-1968) Military Service: Captain, United States Air Force (1942-1946)	 American Bar Association; Bar Association of Metropolitan St. Louis; Cass County Bar Association; Federal Judges Association; North Dakota Bar Association
236	184	 Myron H. Thompson	 September 29, 1980	 President Jimmy Carter	N / A	 Assistant Attorney General, State of Alabama (1972-1974)	N / A	 Partner, Thompson & Faulk (1979-1980)	 Alabama Bar Association; Alabama Lawyers Association; American Bar Association; National Bar Association
149	185	 Nancy C. Dreher	 January 1, 1988	N / A	N / A	N / A	N / A	 Associate then Partner, Leonard, Street & Deinard (1968-1988)	 American Bar Association; Hennepin County Bar Association; Minnesota State Bar Association; National Conference of Bankruptcy Judges
28	186	 Norman H. Stahi	 August 3, 1992	 President George H.W. Bush	N / A	N / A	 District Judge, United States District Court for the District of New Hampshire (1990-1992)	 Partner, Devine, Millimet, Stahl & Branch (1956-1990)	 New Hampshire Bar Association 
145	187	 Pasco M. Bowman Hl	N / A	 President Ronald Reagan	N / A	N / A	 Circuit Judge, United States Court of Appeals for the Eighth	N / A	 Missouri Bar Association; State Bar of Georgi State Bar of New York
291	188	 Paul G. Rosenblatt	 1984	 President Ronald Reagan	N / A	 Assistant Attorney General, State of Arizona (1963-1966); Administrative Assistant, Representative Sam Steiger, United States House of Representatives (1967-1972)	 Presiding Judge, Arizona Superior Court, Yavapai County (1973-£984) ,	 Private Practice (1971-1973) Military Service: United States Army Reserve (1951-1953)	 Arbitration Committee, Chair; Court Security Committee; 9th Circuit Historical Society Technology Committee; State-Federal Judicial Council, Co-Chair
222	189	 Paul H. Roney	N / A	N / A	N / A	N / A	N / A	N / A	N / A
194	190	 Paul J. Kelly, Jr.	 April 14, 1992	 President George H.W. Bush	N / A	 Member, New Mexico House of Representatives (1977-1981)	N / A	 Associate, Hinkle, Bondurant, Cox & Eaton (1967-1971); Partner, Hinkle, Cox, Eaton, Coffield & Hensiey (1971-1992)	 Federal Bar Association; Oliver Seth American Inn of Court; Santa Fe County Bar Association; State Bar of New Mexico
7	191	 Paul R. Michel	N / A	N / A	N / A	N / A	N / A	N / A	N / A
79	192	 Paul V. Niemeyer	N / A	N / A	N / A	N / A	N / A	N / A	N / A
254	193	 Paul W. Greene	N / A	N / A	N / A	N / A	N / A	N / A	N / A
9	194	 Pauline Newman	 May 7, 1984	 President Ronald Reagan	N / A	N / A	N / A	N / A	 American Bar Association; American Patent Law Association; Council on Foreign Relations
224	195	 Peter T. Fay	 1976	 President Gerald Ford	N / A	N / A	 Judge, United States District Court for the Southern District g Florida (1970-1976), Judge, Panel for the Appointment of Independen Counsel	 Partner, Nichols, Gaither, Green, Frates & Beckham . (1956-1961); Partner, Frates, Fay, Floyd & Pearson (and predecessor §, (1961-1970) : Military Service: United States Air Force (1951-1953)	 American Bar Association; Dade County Bar Association
49	196	 Peter W. Hall	N / A	N / A	N / A	N / A	N / A	N / A	N / A
187	197	 Philip H. Brandt	 October 11, 1991	N / A	N / A	 Attorney, Department of Justice (1972); Attorney, Federal	N / A	 LeCocq, Simonarson et al. (1976-1986); Graham & Dunn (1986-1991) Military Service: United States Navy (1966-1969); United States Naval Reserve (1969-1989)	 American Bar Association; King County Bar; National Conference of Bankruptcy Judges; Tacoma-Pierce County Bar; Washington State Bar
225	198	 Phyllis A. Kravitch	 April 10, 1979	 President Jimmy Carter	N / A	N / A	 Judge, Georgia Superior Court (1977-1979)	 Kravitch & Hendrix (and predecessor firms) (1965-1970):	 American Bar Association; American Bar Foundation; American Judicature Society; American Law Institute; Atlan Lawyers Club; Federal Judges Association; Savannah Bar Association; State Bar of Georgia
58	199	 Pierre N. Leva!	 1993	 President William J. Clinton	N / A	 Assistant United States Attorney, Southern District of New	N / A	 Associate then Partner, Cleary, Gottlieb, Steen & Hamilton	N / A
173	200	 Procter Hug, Jr.	 September 16, 1977	 President Jimmy Carter	N / A	N / A	N / A	 Partner, Springer, McKissick & Hug (1958-1963); Partne Woodburn, Wedge, Blakey, Folsom & Hug (1963-1977) Military Service: United States Navy (1953-1955) Nonprofit: General Counsel, University of Nevada System (1972- 1976)	 American Bar Association; American Judicatur Society; American Law Institute; Nevada State Bar
105	201	 R. Guy Cole, Jr.	N / A	N / A	N / A	N / A	N / A	N / A	N / A
213	202	 R. Lanier Anderson Il	 August 6, 1979	 President Timmy Carter	N / A	N / A	 Member, Fudiciai Conference of the United States (1999-2002)	 Associate then Partner, Anderson, Walker & Reichert (1963-1979) Military Service: United States Army Reserve (1958-1961); United States Anny (1961-1963)	 American Bar Association; American Judicature Society; Macon Bar Association; State Bar of Georgia
54	203	 Raiph K. Winter	N / A	N / A	N / A	N / A	N / A	N / A	N / A
270	204	 Ralph R. Beistline	 May 24, 2002	 President George H.W. Bush	N / A	N / A	 Judge, Superior Court of Alaska (1992-2002)	 Associate, Hughes, Thorsness, Gantz, Powell & Brundin	N / A
12	205	 Randall R. Rader ‘Education: Harvard 2004	N / A	N / A	N / A	N / A	N / A	N / A	N / A
11	206	 Raymond C. Clevenger tu - of Circuit 	 August 19, 1992	 President George H.W. Bush	N / A	 Special Assistant to the General Counsel, Department of	N / A	 Wilmer, Cutler & Pickering (1967-1971); Wilmer, Cutler Be Pickering (1972-1990)	 American Bar Association; District of Columbia ament: Assistant United States Attorney, Eastern District of New epartment of Justice (1973-1978), Triai Attorney and Senior Trial al: Commercial Litigation Branch, Civil Division, Department of ce: (1978-1987); Assistant to the Attorney General, Department of Bar , (1988-1992) .
139	207	 Raymond W. Gruender Ill	N / A	N / A	N / A	N / A	N / A	N / A	N / A
47	208	 Reena Raggi	 October 7, 2002	 President George W. Bush	N / A	 Assistant United States Attorney, Eastern District of New York, Department of Justice (1979-1986); United States Attorney, Eastern District of New York, Department of Justice (1986)	 District Judge, United States District Court for the Eastern District of New York (1987-2002)	 Associate, Cahill, Gordon & Reindel (1977-1979); Partner,	N / A
85	209	 Reger L. Gregory	 January 18, 2001	 President William J. Clinton	N / A	N / A	N / A	 Associate, Butzel, Long, Gust, Klien & Van Zile ;	N / A
92	210	 Rhesa H. Barksdale	 April 1990	 President George H.W. Bush	N / A	N / A	N / A	 Butler, Snow, O’Mara, Stevens & Cannada (1973-1990)	N / A
163	211	 Richard A. Paez	 March 14, 2000	 President William J. Clinton	N / A	N / A	 District Judge, United States District Court for the Central District of California (1994-2000), Judge, Los Angeles Municipal Court (1981-1994); Assigned Justice, California Court of Appeal, Second District, Division Seven (1983); Assigned Judge, Los Angeles Superior Court (1993-1994)	 Staff Attorney, California Rural Legal Assistance	N / A
121	212	 Richard A. Posner	 December 4, 1981	 President Ronald Reagan	N / A	 Legal Assistant to Commissioner, Federal Trade Commission	N / A	N / A	 American Economic Association; American Law Institute
165	213	 Richard C. Tallman	N / A	N / A	N / A	N / A	N / A	N / A	N / A
48	214	 Richard C. Wesley	N / A	 President George W. Bush	N / A	 Assistant Counsel to Republican Leader, James L. Emery, New York State Assembly (1979-1982); Member, 136th Assembly District, New York State Assembly (1982-1986)	 Associate Justice, New York Supreme Court, Seventh Judicial District (1987-1996); Associate Justice, New York Supreme Court, Appellate Division, Fourth Department (1994-1996); Associate Judge, New York Court of Appeals (1997-2003)	 Harris, Beach & Wilcox (1974-1976); Associate then Partner, Streb, Porter, Meyer and Wesley (1976-1986)	 Livingston County Bar Association; New York State Bar Association
115	215	 Richard F Suhrheinrich	N / A	N / A	N / A	N / A	N / A	N / A	N / A
53	216	 Richard J. Cardamone	 November 1981	 President Ronald Reagan	N / A	N / A	 Judge, New York Supreme Court (1963-1971); Associate Justice, New York Supreme Court, Appellate Division, Fourth Judicial Department (1971-1981)	 Private Practice (1952-1962) Military Service: United States Navy (1943-1946)	 American Law Institute; New York State Bar; _ Oneida County Bar Association
208	217	 Richard L. Bohanon	 May 13, 1982	N / A	N / A	N / A	N / A	 Partner, Bohanon & Barth (1964-1979); Partner, Andrews, Davis, Legg, Bixler, Milsten & Murrah (1979-1982)	 American Inn of Court; National Conference of Bankruptcy Judges; Oklahoma Bar Association, Oklahoma County Bar Association Spring 2005 Statf Education: Oklahoma City 1999 JD Education: Central Oldahoma 1972 BA Olkamuigee, OK 74447 PO. Box 1347, Okmulgee, OK 74447 Tel; (918) 758-0366 Fax: (918) 756-6928 Tom R. Cornish Bankruptey Judge Began Service: February 8, 1994 Term Expires: February 2008 Eastern District of Oklahoma 
61	218	 Richard L. Nygaard |	 Novernber 1988	 President Ronald Reagan	N / A	 County Councilman, Ene County (1977-1981)	 Judge, Pennsylvania Court of Common Pleas, Sixth District (1981-1988)	 Associate, Orton, Nygaard & Dunlevy (1972-1981) Military Service: United States Naval Reserve (1958-1964)	 Erie County Bar Association; Pennsylvania Bar Association
15	219	 Richard Linn	 January 1, 2000	 President William J, Clinton	N / A	 Patent Examiner, United States Patent and Trademark Office	N / A	 Partner, Marks & Murase, LLP; Partner, Foley & Lardner	 Giles 8. Rich American Inn of Court
45	220	 Robert Allen Katzmann	 July 14, 1999	 President William J. Clinton	N / A	N / A	N / A	N / A	N / A
252	221	 Robert B. Propst	 1980	 President Jimmy Carter	N / A	N / A	N / A	 Partner, Wilson, Propst, Isom, Jackson, Bailey & Boit	N / A
179	222	 Robert Boochever	N / A	N / A	N / A	N / A	N / A	N / A	N / A
289	223	 Robert C. Broomfield	 August 12, 1985	 President Ronald Reagan	N / A	N / A	 Judge, Arizona Superior Court (1971-1985)	 Carson, Messinger, Eiliot, Laughlin & Ragan (1962-1970) Military Service: United States Air Force (1955-1958); Arizona National Guard (1958-1961); United States Air Force Reserve (1961-1972)	 Arizona Judges Association; Federal Judges Association; National Center for State Courts; National Conference of State Trial Judges
44	224	 Robert D. Sack	 August 6, 1998	 President William J. Clinton	N / A	N / A	N / A	 Associate then Partner, Pavia & Harcourt (1984-1992)	N / A
76	225	 Robert E. Cowen	 November 1987	 President Ronald Reagan	N / A	 Assistant Prosecutor, Essex County (1969-1970); Deputy Attorney General, Organized Crime and Special Prosecutions Section, Criminal Justice Division, State of New Jersey (1970-1973); Director, Division of Ethics & Professional Services, Administrative Office of the Courts, State of New Jersey (1973-1978)	 Magistrate Judge, United States District Court for the District of New fersey (1978-1985); District Judge, United States District Court for the District of New Jersey (1985-1987)	 Associate, Schreiber, Lancaster & Demos (1959-1961); Private Practice (1961-1969) Military Service: United States Army (1953-1954)	 American Bar Association, Fellow; Federal Judges Association; National Association of Bar Counsel; New Jersey State Bar 
210	226	 Robert E. Nugent	N / A	N / A	N / A	N / A	N / A	N / A	N / A
195	227	 Robert H. Henry	 May 11, 1994	 President William J. Clinton	N / A	 Member, Okiahoma House of Representatives (1976-1986);	N / A	 Partner, Henry, West, Sill & Combs (1977-1983); Partner, Henry, Henry & Henry (1983-1987)	 American Bar Association; American Bar Foundation; National Conference of Commissioners on Uniform State Laws; Oklahoma Bar Association; Oklahoma City Bar Association; William J. Holloway, Jr. American Inn of Court
202	228	 Robert H. McWilliams	N / A	N / A	N / A	N / A	N / A	N / A	N / A
147	229	 Robert J.	N / A	N / A	N / A	 Referee, Hennepin County Conciliation Court (1979);	N / A	 Associate, Kressel, Cecere & Seiler (1972-1976); Partner,	N / A
290	230	 Roger G. Strand	N / A	N / A	N / A	N / A	N / A	N / A	N / A
55	231	 Roger J. Miner	 August 2, 1985	 President Ronald Reagan	N / A	 City Attorney (1961-1964); Assistant District Attorney, State of New York (1964); District Attorney, State of New York (1968-1975)	 Judge, New York Supreme Court (1976-1981); Judge, United.	N / A	 American Bar Association; American Judicature Society; American Law Institete; American Society of Writers on Legal Subjects (Scribes); Association of the Bar of the City of New York: Association of Trial Judges; Columbia County Bar Association; Federal Bar Council; Federal Judges Association; New York State Bar; New York Trial Lawyers Association; Practicing Law Institute Board of Directors FEDERAL COURTS—UNITED STATES COURTS OF APPEALS
132	232	 Roger L. Wollman :	 September 6, 1985	 President Ronald Reagan	N / A	 State’s Attorney, Brown County, State of South Dakota (1967-1971)	 Associate Justice, South Dakota Supreme Court (1971-1985); Member, Judicial Conference of the United States (1999-2002)	 Associate, Law Office of Douglas W. Bantz (1964-1971) Military Service: United States Army (1957-1959)	 American Judicature Society; State Bar of South Dakota
106	233	 Ronald Lee Gilman	N / A	N / A	N / A	N / A	N / A	N / A	N / A
162	234	 Ronald M. Gould	 January 3, 2000	 President William J. Clinton	N / A	N / A	N / A	 Summer Associate, Arncld & Porter (1972); Associate, Perkins Coie (1975-1980); Partner, Perkins Coie (1981-1999)	 American Bar Association; American Judicature Society; King County Bar Association; Ninth Judicial Circuit Historical Society; Supreme Court Historical Society; University of Michigan Law School Committee of Visitors; Washington State Bar Association
