	id	Judge	Education:	Began Service:	Appointed By:	Circuit Assignment:	Government:	Judicial:	Legal Practice:
42	235	 Rosemary 5S. Pooler	 Fune 9, 1998	 President William J. Clinton	N / A	 Director of Consumer Affairs Unit and Assistant Corporation	N / A	N / A	N / A
218	236	 Rosemary Barkett	 April 24, 1994	 President William J. Clinton	N / A	N / A	 Judge, Florida Cireuit Court, 15th Judicial Circuit (1979-1982), Administrative Judge, Civil Division, Florida Circuit Court, 15th Judici District (1982-1983); Chief Fudge, Fifteenth Judicial Circuit, State of Florida (983-1984); Appellate Judge, Florida District Court of Appeal, Fourth District (1984-1985); Justice, Florida Supreme Court (1985-1992 Chief Justice, Florida Supreme Court (1992-1994)	 Private Practice (1971-1979)	 American Bar Association; American Law Institute; American Society of International Law; Federal Judges Association; Florida Association of Women Lawyers; Florida Bar; International Women’s Forum; Lawyers for Children; National Associa of Women Judges; United States Association of Constitutional Law
280	237	 Roslyn O. Silver	N / A	N / A	N / A	N / A	N / A	N / A	N / A
70	238	 Ruggero J. Aldisert	N / A	N / A	N / A	N / A	N / A	N / A	N / A
5	239	 Ruth Bader Ginsburg	 August 16, 1993	 President William J. Clinton	 Second Judicial Circuit	N / A	 Circuit Judge, United States Court of Appeals for the District of	N / A	 American Academy of Arts and Sciences; American Bar Association; American Law Institute; Association of the Bar of the City of New York; Council on Foreign Relations; District of Columbia Bar
62	240	 Samuel A. Alito, Jr.	 June 15, 1990	 President George H.W. Bush	N / A	 Assistant United States Attorney, Department of Justice	N / A	N / A	N / A
1	241	 Sandra Day O'Connor	 September 25, 198]	 President Ronald Reagan	 Ninth Fudicial Circuit	 Deputy County Attorney, $an Mateo County (1952-1953);	N / A	 Civilian Attorney, Quartermaster Market Center, Frankfurt am Main, West Germany, United States Army (1954-1957); Private Practice (1958-1960)	 American Bar Association; Arizona Judges’ Association; Arizona Women Lawyers’ Association; Maricopa County Bar Association; National Association of Women Judges; State Bar of Arizona; State Bar of California FEDERAL COURTS~SUPREME COURT OF THE UNITED STATES
23	242	 Sandra L. Lynch	N / A	N / A	N / A	N / A	N / A	N / A	N / A
32	243	 Sara E. de Jesus	N / A	N / A	N / A	N / A	N / A	N / A	N / A
245	244	 Sharon Lovelace	 July 8, 1991	 President George H.W. Bush	N / A	 Assistant United States A@orney, Northern District of	N / A	N / A	 Birmingham Bar Association; Federal Judges Association Adjunct Faculty, University of Copenhagen School of Law Municipal Judge, City of Muscle Shoals (1978-1979); Presiding fabama Circuit Court, 31st Judicial Circuit (1979-1998) actice: Associate, Dragsted, Kromann, Norregaard & Friis (971); Partner, Johnson & Fohnson (1973-1979) at Memberships: Alabama State Bar Association; Federal Judges ai; United States District Judges Association
17	245	 Sharon Prost	 October 2001	 President George W. Bush	N / A	 Labor Relations Specialist, United States Civil Service	N / A	N / A	N / A
158	246	 Sidney R. Thomas	 March 11, 1996	 President William J. Clinton	N / A	N / A	N / A	 Partner, Moulton, Bellingham, Longo & Mather (1978-1996)	 American Bar Association; Federal Judges Association; Montana Bar Association; Yellowstone County Bar Association
267	247	 Sonja Faye Bivins	 February 2, 2004	N / A	N / A	N / A	N / A	N / A	 Alabama State Bar; State Bar of Georgia A. Mahoney icy Judge “Birth: 1949 ant Col St Catherine 1971 BA; Minnesota 1974 JD Service: December 13, 1993 xpires: December 12, 2007 ‘nie: Editor, American Bankruptcy Law Journal (1998-2002) al: Bankruptcy Judge, United States Bankruptcy Court for the District sota (1984-1987}; Bankruptcy Judge, United States Bankruptcy for the Southern District of Texas (1987-1989); Chief Judge, ed States Bankruptcy Court for the Southern District of Alabama 2003) Practice: Partner, Weil, Gotshal & Manges (1989-1993) 
214	248	 Stanley Francis Birch, Jr.	 1990	 President George H.W. Bush	N / A	N / A	N / A	 Greer, Sartain & Carey (1974-1976); Deal, Birch, Jarrard & Link (1976-1983); Birch, Hartness & Link (1983-1985); Vaughan, Davis, Birch & Murphy (1985-1990) Military Service: Vietnam Veteran, Army Special Forces, United States Army (1970-1972)	 Atlanta Bar Association; Eleventh Circuit Historical Society; Federal Bar Association; Gainesville Northeastern Bar Association; Georgia Bar Foundation; Georgia Legal History Foundation; Lawyers Club of Atlanta; Old War Horse Lawyers Club; State Bar of Georgia; Supreme Court Historical Society
192	249	 Stephanie K. Seymour	 November 16, 1979	 President Jimmy Carter	N / A	N / A	N / A	 Associate, Goodwin, Proctor & Hoar (1965-1966); Associate, Lupardus, Holliman & Huffman (1966-1967); Associate, Baker & Botts (1968-1969); Associate, Doerner, Stuart, Saunders, Daniel & Anderson (1971-1975); Partner, Doerner, Stuart, Saunders, Daniel & Anderson (1975-1979)	 American Bar Association; American Inn of Court, Council Oak Chapter; Federal Judges Association; National Association of Women Judges; Oklahoma Bar Association; Tulsa County Bar Association
235	250	 Stephen FE Williams	 1986	 President Ronald Reagan	N / A	N / A	N / A	 Debevoise, Plimpton, Lyons & Gates (1962-1966) Military Service: United States Army (1961-1962)	 American Bar Association; American Law Institute; Federal Energy Bar Association
6	251	 Stephen G. Breyer	 August 3, 1994	 President William J. Clinton,	 Tenth Judicial Circuit Academie: Assistant Professor, Professor of Law and Lecturer, Harvard University Law School (1967-1995), Professor, Harvard University Kennedy School of Government (1977-1980); Visiting Professor, Colleg of Law, Sydney, Australia; Visiting Professor, University of Rome Clerkships: Law Clerk The Honorable Arthur Goldberg, United States Court of Appeals for the First Circuit	 Speciai Assistant to the Assistant Attorney General (Antitrust), Department of Justice (1965-1967); Assistant Speciai Prosecutor, Watergate Special Prosecution Force (1973); Special Counse| (Staff Director for Investigation of the Civii Aeronautics Board}, Administrative Practices Subcommittee, Committee on the Judiciary, United States Senate (1974-1975); Chief Counsel, Committee on the Judiciary, United States Senate (1979-1980); Member, United States Sentencing Commission ([985-1989); Member, United States Judicial Conference (1990-1994)	 Circuit Judge, United States Court of Appeals for the First Circuit	N / A	 American Academy of Arts and Sciences; American Bar Association; American Law Institute ited States Court of Appeals for .e Federal Circuit rd T. Markey National Courts Bldg., 717 Madison PL, NW, ington, DC 20439 oe (202) 633-6550 Tel: (202) 786-6584 (Electronic Opinions Data) '202) 633-9608 (Electronic Opinions Data) (202) 633-6550 (Electronic Opinions Voice} Fax: (202) 633-9623 émmet: www.fedcir.gov mber of Judgeships: 12 preme Court Justice: Chie? Justice William H. Rehnquist é United States Court of Appeals for the Federal Cirevit handies cases gubject matter without regard to the region. The Court hears all appeals the United States Court of Federal Claims, the United States Court of ternational Trade and the United States Court of Veterans Appeals. The federal Circuit hears appeals from United States District Courts in patent ases, cases involving energy regulation and economic stabilization as well appeals from a variety of administrative proceedings. Established in 82, the Washington, DC-based Federal Circuit possesses national jurisdiction as a result of the merger between the Appellate Division of the ‘ormer United States Court of Claims and the United States Court of Slistoms and Patent Appeals. Statf : Law Clerk Christina D. Bumett ..................-.. (202) 479-3000: Education: Yale JD Career: Law Clerk, Judge Jose A. Cabranes, United States Court of Appeals for the Second Circuit Law Clerk James P Dowden .............---.:0 cues (202) 479-3000. Education: Boston Col JD : Career: Law Clerk, Judge Anthony Scirica, United States Court of Appeais for the Third Circuit Law Clerk Aimee Feinberg.........-....00.eeee caus (202) 479-3000 Education: Stanford 2002 JD Career: Law Clerk, Judge David S. Tatel, United States Court of Appeals for the District of Columbia Circuit . Law Clerk Jacob Sullivan. ................000..000. (202) 479-3000 Education: Yale 1998 BA: Oxford (UK) 2600 MPhil; Yaie 2003 JD Career: Law Clerk, Judge Guido Calabresi, United States Court of Appeals for the Second Circuit ourt 
278	252	 Stephen M. McNamee	 June 8, 1990	 President George H.W, Bush	N / A	 Assistant United States Attorney, District of Arizona,	N / A	N / A	 Maricopa County Bar Association; State Bar of Arizona
154	253	 Stephen Reinhardt	N / A	N / A	N / A	N / A	N / A	N / A	N / A
138	254	 Steven M. Coiloton	N / A	N / A	N / A	N / A	N / A	N / A	N / A
216	255	 Susan Harrell Black	N / A	N / A	N / A	N / A	N / A	N / A	N / A
160	256	 Susan P Graber	 April 1, 1998	 President William J. Clinton	N / A	 Assistant Attorney General, Bureau of Revenue, State of Oregon (1972-1974), Arbitrator, Oregon Cireuit Court, Fourth Judicial District (1985-1988); Mediator, United States District Court for the j: Judge, United States District Court for the Central District of District of Oregon (1986-1988) . is (1996-1998)	 Judge Pro Tem, Multnomah County District Court (1983-1988), Practice: Associate, O'Melveny & Myers (1980-1987); Partner,	N / A	 American Bar Association; American Law Institute hips: Law Clerk The Honorable William Gray, United States District ‘or the Central District of California (1979-1980) mbers of Circuit Judge William A. Fletcher eventh St, San Francisco, CA 94103-1526
282	257	 Susan R. Bolton	N / A	N / A	N / A	N / A	N / A	N / A	N / A
257	258	 Tamara O. Mitchell	 January 4, 1992	N / A	N / A	N / A	N / A	 Sole Practitioner (1981-1983); Partner, Gradsky &	N / A
126	259	 Terence T. Evans	 September 1, 1995	 President William J. Clinton	N / A	 Assistant District Attorney, Milwaukee County, State of Wisconsin (1968-1970)	 Judge, Milwaukee County Court (1974-1978); First Circuit Judge, First Judicial Administrative District (1978-1980); District Judge, United States District Court for the Eastern District of Wisconsin (1980-1995)	 Associate, Cool & Franke (1970-1972); Partner, Cook & Franke (1972-1974)	 American Bar Association; Judicial Council of Seventh Circuit; Milwaukee Bar Association; Seventh Circuit Bar Association; State Bar of Wisconsin
207	260	 Terrence L. Michael	 June 9, 1997	N / A	N / A	N / A	 Chief Bankruptcy Judge, United States Bankruptcy Court for the Northern District of Oklahoma (1999-2001)	 Baird, Holm Law Offices (1983-1997)	 American Bankruptcy Institute
198	261	 Terrence L. O’Brien	 April 23, 2002	 President George W. Bush	N / A	 Staff Attorney, United States Department of Justice, Land and Natural Resources Division/Appellate Section (1972-1974)	 Judge, Sixth Judicial District Court of Wyoming (1998-2000)	 Proprietor and Associate, Omohundro and O’Brien	N / A
255	262	 Terry Michael Putnam	 1973 il: Jenny_Rowe@alnd,uscourts. gov . , Virginia Hare ..................... 205) 278-1960 ext. 730	 President Richard M. Nixon Staff an Virginia Hare (205) ext. 7	N / A	N / A	N / A	 Associate, Potts é& Young (1979-1983); Partner, Potts, Young, Blasingame & Putnam (1983-1987)	 Alabama Bar Association; Federal Magistrate E-mail: Pam_Arenberg(@alnd.uscourts.gov Judicial Assistant Suzan Blackshear................-. E-mail: Suzan_Blackshear@alnd.uscourts.gov Spring 2005 © Leadership Directories, inc. Judicial Yellow Bo United States Bankruptcy Court for the Northern District of Alabama 89 bers of Magistrate Judge Robert R. Armstrong, Black U.S. Courthouse, 1729 Fifth Ave. N., ‘am, AL 35203 278-1910 Fax: (205) 278-1914 “Armstrong, Jr. rT h: 1948 Alabama 1970 BA; Cumberland 1974 JD Service: August 8, 1990 | Affiliation: Republican sj: Presiding Judge, Alabama Cirenit Court, 18th Judicial Cironit, ‘County (1987-1990) Military Service: United States Army (1946-1947) etk Beth fer ‘ios? iD os or satin og PH Oc (205) 278-1913 Dateok Bat 128) 
64	263	 Theodore A. McKee	 June 20, 1994	 President William J, Clinton	N / A	 Assistant United States Attorney, Eastern District of Pennsylvania, Department of Justice (1977-1980); Deputy City Solicitor, Law Department, City of Philadelphia (1980-1983); General Counsel, Philadelphia Parking Authority (1983)	 Judge, Pennsylvania Court of Common Pleas, First Judicial District (1984-1994)	 Associate, Wolf, Block, Schorr & Solis-Cohen ( 1975-1977).	 American Bar Association; Barristers’ Association, of Philadelphia; Fox Chase Cancer Center; National Bar Association; Pennsyivania Bar Association; Philadelphia Bar Association
142	264	 Theodore McMillian	 1978	 President Jimmy Carter	N / A	N / A	N / A	N / A	 American Judicature Society; Missouri Bar Association; Mound City Bar Association; St. Louis Lawyers Association
260	265	 Thomas B. Bennett	N / A	N / A	N / A	N / A	N / A	N / A	N / A
129	266	 Thomas E. Fairchild	 August 11, 1966	 President Lyndon B. Johnson	N / A	 Attorney, Office of Price Administration (1941-1945); Hearing Commissioner (1945); Attorney General, State of Wisconsin (1948-3951); United States Attorney, Western District of Wisconsin, Department of Justice (1951-1952)	 Justice, Wisconsin Supreme Court (1957-1966)	 Daniel H. Grady (1938-1941); Associate, Miller, Mack & Fairchild (1945-1948), Partner, Fairchild, Charne, and Kops (1953-1957)	 American Bar Association; American Judicature Society; American Law institute; Bar Association for the Seventh Federal Circuit; Dane County Bar Association; Milwaukee Bar Association; State Bar of Wisconsin
185	267	 Thomas G. Nelson	 November 2, 1990	 President George H.W. Bush	N / A	 Assistant Attorney General then Chief Deputy Attorney	N / A	 Partner, Parry, Robertson & Daly (1965-1979); Partner, Nelson, Rosholt, Robertson, Tolman and Tucker (1979-1990) Military Service: Idaho Air National Guard (1962-1965); United States Army Reserve (1965-1968)	 American Bar Foundation; American Board of Trial Advocates; American College of Trial Lawyers; Idaho Law Foundation; Idaho State Bar (208) 334-1612 (208) 334-1612 W Clerk Sarah Capelli.................2...0.0005 (208) 334-1612 dministrative Officer Toni Smith.............2...000. (208) 334-1612 cial Assistant Ghris Redenbo .................... (208} 334-1612 inited States Bankruptcy Appellate Panel for he Ninth Circuit a Courthouse, 125 §. Grand Ave., Pasadena, CA 91105 ti (626) 229-7225 Fax: (626) 229-7475 it Thet: www.ce9.uscourts.gov/bap 
99	268	 Thomas M. Reaviey	N / A	N / A	N / A	N / A	N / A	N / A	N / A
16	269	 Timothy B. Dyk	 June 9, 2000	 President William J. Clinton	N / A	 Special Assistant to the Assistant Attorney General, United	N / A	 Associate and Partner, Wilmer, Cutler & Pickering	N / A
151	270	 Timothy J. Mahoney.	 June 28, 1985	N / A	N / A	N / A	N / A	 Partner, Mahoney Jordan Law Firm (1972-1985) Military Service: National Guard (1967-1973)	 Iowa Bar Association; Nebraska Bar Association: Omaha Bar Association nber of Judgeships: 28 reme Court Justice: Associate Justice Sandra Day O’Connor iS Covered: Alaska, Arizona, California, Guam, Hawaii, Idaho, tana, Nevada, Northern Mariana Islands, Oregon and Washington ourt 
200	271	 Timothy M. Tymkovich	 June 19, 2003	 President George W. Bush	N / A	 Law Clerk, Colorado Supreme Court {1982-1983}; Solicitor	N / A	 Associate, Davis Graham & Stubbs (1983-1989); Partner, Hale, Hackstaff, Tymkovich & ErkenBrack (1996-2003)	 American Bar Association; American Law Institute; Colorado Bar Foundation; International Society of Barristers
209	272	 Tom R. Cornish	N / A	N / A	N / A	N / A	N / A	N / A	N / A
237	273	 Truman M. Hobbs	N / A	N / A	N / A	N / A	N / A	N / A	N / A
244	274	 U. W. Clemon	N / A	N / A	N / A	N / A	N / A	N / A	N / A
241	275	 Vanzetta Penn	N / A	N / A	N / A	 Assistant Attorney General, State of Alabama (1975-1978)	 Magistrate, Montgomery County Family Court	 Associate, Hughes, Hubbard & Reed (1974-1975); Privat	N / A
292	276	 Virginia A. Mathis	 March 15, 1996	N / A	N / A	N / A	N / A	N / A	N / A
249	277	 Virginia E. Hopkins	N / A	N / A	N / A	N / A	N / A	N / A	N / A
262	278	 W. Brevard Hand	 1971	 President Richard M. Nixon	N / A	N / A	N / A	 Associate then Partner, Hand, Arendali, Bedsole, Greaves & Fohnston (1949-1971) Military Service: United States Army (1943-1946)	 Alabama State Bar Association; American Bar Association; Federal Bar Association; Mobile Bar Association
89	279	 W. Eugene Davis	N / A	N / A	N / A	N / A	N / A	N / A	N / A
239	280	 W. Harold Albritton HI Education: Georgia 1988 JD	N / A	N / A	N / A	N / A	N / A	N / A	N / A
74	281	 Walter K. Stapleton	 May 1985	 President Ronald Reagan	N / A	N / A	 Judge, United States District Court for the District of Delaware (1970-1985)	 Associate, Morris, Nichols, Arsht & Tunnell (1959-1965); Partner, Morris, Nichols, Arsht & Tunnell (1965-1970)	 American Bar Association; American Fudicature Society; Delaware Bar Association
176	282	 Warren J. Ferguson	 1979	 President Jimmy Carter	N / A	 City Attorney (1953-1959)	 Judge, Orange County Municipal Court (1959-1961); Judge, California Superior Court, Juvenile Court Division, Orange County (1961-1964); Judge, California Superior Court, Appellate Department (1965-1966); District Judge, United States District Court for the Central District of California (1966-1979)	 Ferguson & Judge (1950-19595 Military Service: United States Army (19421945)	 American Bar Association; California Bar Association; Grange County Bar Association
50	283	 Wilfred Feinberg Windham County Bar Association	 March 18, 1966	 President Lyndon B. Johnson	N / A	 Deputy Superintendent, Banking Department, State of New York (1958)	 Judge, United States District Court for the Southern District of New York (1961-1966)	 Associate, Kaye, Scholer, Fierman & Hays (1949-1953); Partner, McGoldrick, Dannett, Horowitz & Golub (1953-1961) Military Service: United States Army (1942-1945)	 American Bar Association; American Judicature Society; American Law Institute; Bar Association of the City of New York; New York County Lawyers Association hambers of Senior Judge Thomas J. Meskill 'd Post Office Plaza, 114 W. Main St., Ste. 204, New Britain, CT 06051 {: (G60) 224-2617 Fax: (860) 826-4793 ‘omas J. Meskill ate of Birth: 1928 Education: Trinity Col (CT) 1950 BS; Connecticut 1956 LLB E gan Service: April 22, 1975 ‘Appointed By; President Gerald Ford Political Affiliation: Republican ‘Government: Assistant Corporation Counsel, City of New Britain (1960-1962); Mayor, City of New Britain (1962-1964); Corporation Counsel, City of New Britain (1965-1967), Member from Connecticut, United States House of Representatives (1967-1970); Governor, State of . ( connecticut (1971-1975) ‘Legal Practice: Partner, Meskill, Dorsey, Sledzik & Walsh (1956-1960) Military Service: United States Air Force (1950-1953) 
100	284	 Will Garwood	 November 9, 1981	 President Ronald Reagan	N / A	N / A	 Justice, Texas Supreme Court (1979-1980)	 Partner, Graves, Dougherty, Hearon, Moody & Garwood © (and predecessor firms) (1959-1979) Military Service: United States Army (1956-1959)	 American Judicature Society; American Law Institute; Texas Bar Foundation éns Attorney Dennis ©. Harrell... . cation: Wabash Col 1967 BA: 
84	285	 William 6. Traxler, Jr.	 October 21, 1998	 President William J. Clinton .	N / A	 Chief Deputy Solicitor, Thirteenth Judicial Circuit, State of South Carolina (1975-1981); Solicitor, Thirteenth Judicial Circuit, State of South Carolina (1981-1985)	 Resident Judge, Thirteenth Judicial Circuit (4 985-1992); Judge, United States District Court for the District of South Carolina (1992-4998)	 William Byrd Traxler, Sr. (1973-1974) Military Service: United States Army Reserve (1970-1978)	 Greenville County Bar Association; South Carolina Bar Association; Federal Judges Association Spring 2005 © Leadership Directories, Inc. bebo ce cece tut eveeeees (304) 347.355 ] Leben ce eens (304) 347.35] Dabber tnt eee eee een (4103 962-3606 Law Clerk Katherine Newberger.................... (410) 962-3606 © WG BEET ERO De emamniee oes (410) 962-3606 ° eet rr eee (410) 962-3606 : Secretary Dorothy Phillips........0..00........002., (410) 962-3606 - Judicial Yellow Book “op circuit Judge William B. Traxler, Jr. continued ers. 0! Dodd M. Davis... 0.6... 2.eeeeee reece (864) 241-2733 » South Carolina 1992 JD i my ©. Hendrix ..........2. 2.0... ce eee (864) 244-2734 tion: South Carolina 1989 ID jerk Thome M, Loggins «6.6.6... ee eee ee (864) 241-2735 ae nm: South Carolina 1992 JD fon eth Burke Richardson... ee see 36a) avo ‘in: Washington U 2000 JD cy Mary Lee Mowry......-....-.- 22-2 2e aes (864) 241-2730 en n: Presbyterian Col BA erk tion erk Al bers of Circuit Judge Robert B. King art C. Byrd U.S. Courthouse, 300 Virginia Street East, 6 “7602, Charleston, WV 25301 ai ies 347-3533 Fax: (304) 347-3534 if. RBK@ca4.uscourts.gov Robert B. King Circuit Judge Date of Birth: 1940 Education: West Virginia 1961 BA, 1968 JD Began Service: October 23, 1998 Appointed By: President William J. Clinton ademic: School Teacher, Rural Greenbrier County (1964-1965), @search Assistant, Center for Appalachian Studies and Development, ‘West Virginia University (1966-1968) kships: Law Clerk The Honorable John A. Field, Jr., United States District Court for the Southern District of West Virginia (1968-1969) vernment: Assistant United States Attorney, Southern District of West Virginia, Department of Justice (1970-1974), United States Attorney, Southern District of West Virginia, Department of Justice (1977-1981) Legal Practice: Associate, Haynes & Ford (1969-1970); Associate then Partner, Spiiman, Thomas, Battle & Klostermeyer (1975-1977); Partner, Spilman, Thomas, Battle & Klostermeyer (1981); Partner, King, Allen, Guthrie & McHugh (and predecessor firms) (1981-1998) Military Service: West Virginia National Guard (1957-1959); United States Air Force (1961-1964) 
13	286	 William C. Bryson	 August 14, 1990	 President George H.W. Bush	N / A	 Assistant to the Solicitor General, Department of Justice (1978-1979); Chief, Appellate Section, Criminal Division, Department of Justice (1979-1982); Special Counsel, Organized Crime and Racketeering Section, Criminal Division, Department of Justice (1982-1986); Deputy Solicitor General, Department of Justice (1986-1994) 	 Judge, United States Court of Claims (1988-1990)	N / A	 District of Columbia Bar; Federal Bar Association
178	287	 William C. Canby, Jr.	N / A	N / A	N / A	N / A	N / A	N / A	N / A
288	288	 William D. Browning	 May 3, 1984	 President Ronald Reagan	N / A	N / A	N / A	 Partner, Estes & Browning (1960-1962); Partner, Rees, Estes, Browning (1962-1969); Partner, Estes, Browning & Zlaket (1969-1972); Partner, Browning & Druke (1973-1974); Partner, Browning, Druke & Hawkins (1974-1976); Partner, Slutes, Browning, Zlaket & Sakrison (1976-1981); Partner, Slutes, Browning, Sakrison & Grant (1981-1984) Military Service: United States Air Force (1954-1957), Air National Guard (1958-1962)	 American Bar Association; American Bar Foundation; American Board of Trial Advocates; American College of Trial Lawyers; American Judicature Society; Institute for Court Management; Ninth Circuit Judicial Conference; Pima County Bar Association; State Bar of Arizona
264	289	 William E. Cassady	N / A	N / A	N / A	N / A	N / A	N / A	N / A
220	290	 William H. Pryor Jr.	N / A	N / A	N / A	N / A	N / A	N / A	N / A
201	291	 William J. Holloway, Jr.	 September 26, 1968	 President Lyndon B. Johnson	N / A	 Attorney, General Litigation Section, Claims Division,	N / A	 Partner, Holloway & Holloway (1950-1951); Associate then Partner, Crowe & Dunievy (1952-1968) Military Service: United States Army (1943-1946)	 American Bar Association; Federal Bar Association; Oklahoma Bar Association; Oklahoma County Bar Association FEDERAL COURTS—UNITED STATES COURTS OF APPEALS
135	292	 William Jay Riley	N / A	N / A	N / A	N / A	N / A	N / A	N / A
253	293	 William M. Acker, Jr.	N / A	N / A	N / A	N / A	N / A	N / A	N / A
242	294	 William R.	N / A	N / A	N / A	N / A	N / A	N / A	N / A
268	295	 William S.	N / A	N / A	N / A	N / A	N / A	N / A	N / A
77	296	 William W. Wilkins	 July 1986	 President Ronald Reagan	N / A	 State Campaign Director, Re-elect Senator Thurmond (1972) Legislative Assistant to Senator Strom Thurmond, United States Senate (1970-1971); Part-time Assistant Circuit Solicitor, Circuit Solicitor’s Office, 13th Jndicial Circuit (1971-1972); Part-time Assistant County Solicitor, County Solicitor’s Office, Greenville County (1973-1974): Solicitor, Circuit Solicitor’s Office, 13th Judicial Circuit (1974-198 1}; Chair, United States Sentencing Commission (1985-1994)	 Judge, United States District Court for the District of South, Carolina (1981-1986); Chair, Committee on Criminal Law of the Judicial Conference of the United States (1999-2003)	 Partner, Wilkins, Wilkins, Nelson & Kittredge (1971-1978) Military Service: United States Army (1967-1969); United States Army Reserve (1969-1983); South Carolina National Guard (1983-1994)	 South Carolina Bar Association
